{
  "id": "silver_gelatin",
  "name": "Silver Gelatin / Tonal B&W",
  "description": "Pure grayscale master. Hard-locks neutral centroids to prevent chromatic noise.",
  "centroid": {
    "l": 50,
    "c": 2,
    "k": 100,
    "l_std_dev": 28,
    "hue_entropy": 0.05,
    "temperature_bias": 0.0,
    "primary_sector_weight": 0.95
  },
  "weights": {
    "l": 0.5,
    "c": 5.0,
    "k": 1.0,
    "l_std_dev": 2.0,
    "hue_entropy": 5.0
  },
  "parameters": {
    "targetColorsSlider": 8,
    "ditherType": "atkinson",
    "distanceMetric": "cie94",
    "lWeight": 2.0,
    "cWeight": 0.5,
    "blackBias": 5.0,
    "vibrancyMode": "linear",
    "vibrancyBoost": 1.0,
    "vibrancyThreshold": 0,
    "highlightThreshold": 94,
    "highlightBoost": 1.2,
    "enablePaletteReduction": true,
    "paletteReduction": 6.0,
    "substrateMode": "white",
    "substrateTolerance": 2.0,
    "shadowPoint": 5,
    "enableHueGapAnalysis": false,
    "hueLockAngle": 10,
    "colorMode": "grayscale",
    "preserveWhite": true,
    "preserveBlack": true,
    "ignoreTransparent": true,
    "maskProfile": "Gray Gamma 2.2",
    "neutralSovereigntyThreshold": 35,
    "neutralCentroidClampThreshold": 1.0,
    "preprocessingIntensity": "medium"
  }
}
