{
  "id": "terracotta_ochre",
  "name": "Terracotta Ochre (High Compression)",
  "description": "Optimized for Ayyanar Shrines, oxidized clay, and earthen pigments. Aggressive hue-grouping to ensure solid ink coverage.",
  "preferred_sectors": [
    "orange",
    "red",
    "yellow"
  ],
  "centroid": {
    "l": 52,
    "c": 35,
    "k": 75,
    "l_std_dev": 20,
    "hue_entropy": 0.30,
    "temperature_bias": 0.75,
    "primary_sector_weight": 0.45
  },
  "weights": {
    "l": 0.5,
    "c": 1.5,
    "k": 1.0,
    "l_std_dev": 2.0,
    "temperature_bias": 3.0
  },
  "parameters": {
    "targetColorsSlider": 6,
    "engineType": "balanced",
    "centroidStrategy": "SALIENCY",
    "ditherType": "none",
    "distanceMetric": "cie94",
    "lWeight": 0.5,
    "cWeight": 3.0,
    "blackBias": 3.0,
    "vibrancyMode": "aggressive",
    "vibrancyBoost": 1.8,
    "vibrancyThreshold": 10,
    "highlightThreshold": 90,
    "highlightBoost": 1.3,
    "enablePaletteReduction": true,
    "paletteReduction": 8.0,
    "substrateMode": "auto",
    "substrateTolerance": 3.0,
    "shadowPoint": 20,
    "enableHueGapAnalysis": true,
    "hueLockAngle": 28,
    "colorMode": "color",
    "preserveWhite": true,
    "preserveBlack": true,
    "ignoreTransparent": true,
    "maskProfile": "Gray Gamma 2.2",
    "neutralSovereigntyThreshold": 20,
    "neutralCentroidClampThreshold": 3.0,
    "preprocessingIntensity": "medium",
    "shadowClamp": 5.0,
    "speckleRescue": 4,
    "medianPass": false,
    "minVolume": 2.0
  }
}
