{
  "id": "jethro_monroe_clinical",
  "name": "Jethro Monroe / Sovereign 10-Color Lock",
  "description": "Hard-coded v1 physics with Mk 1.5 stability. 10-color partition.",
  "preferred_sectors": ["blue", "cyan"],
  "centroid": {
    "l": 45,
    "c": 12,
    "k": 32,
    "l_std_dev": 28,
    "hue_entropy": 0.15,
    "temperature_bias": -0.2,
    "primary_sector_weight": 0.85
  },
  "weights": {
    "l": 1.0,
    "c": 2.5,
    "k": 1.0,
    "l_std_dev": 2.0,
    "temperature_bias": 1.0
  },
  "parameters": {
    "centroidStrategy": "SALIENCY",
    "targetColorsSlider": 8,
    "distanceMetric": "cie76",
    "lWeight": 1.0,
    "cWeight": 2.5,
    "vibrancyMode": "aggressive",
    "vibrancyBoost": 2.0,
    "paletteReduction": 12.0,
    "enablePaletteReduction": true,
    "neutralCentroidClampThreshold": 15.0,
    "isolationThreshold": 25.0,
    "preserveWhite": true,
    "preserveBlack": true,
    "preservedUnifyThreshold": 0.5,
    "enableHueGapAnalysis": true,
    "bitsPerChannel": 16,
    "ditherType": "none",
    "blackBias": 8.0,
    "highlightThreshold": 95,
    "highlightBoost": 1.5,
    "substrateMode": "none",
    "substrateTolerance": 3.5,
    "shadowPoint": 8,
    "hueLockAngle": 2,
    "colorMode": "color",
    "ignoreTransparent": true,
    "maskProfile": "Gray Gamma 2.2",
    "neutralSovereigntyThreshold": 0,
    "densityFloor": 0.0,
    "preprocessingIntensity": "off",
    "shadowClamp": 6.0,
    "speckleRescue": 4,
    "chromaGate": 1.5
  }
}
