{
  "id": "warm_tonal_optimized",
  "name": "Warm Tonal / Yellow Protect",
  "description": "Landscape-optimized. Uses high hue-locking and temperature bias to protect yellows from muddying.",
  "preferred_sectors": ["yellow", "orange", "chartreuse"],
  "centroid": {
    "l": 55,
    "c": 35,
    "k": 70,
    "l_std_dev": 22,
    "hue_entropy": 0.45,
    "temperature_bias": 0.65,
    "primary_sector_weight": 0.30
  },
  "weights": {
    "l": 0.5,
    "c": 1.5,
    "k": 1.0,
    "l_std_dev": 2.0,
    "temperature_bias": 3.0
  },
  "parameters": {
    "targetColorsSlider": 10,
    "ditherType": "none",
    "distanceMetric": "cie94",
    "lWeight": 0.3,
    "cWeight": 5.0,
    "blackBias": 4.0,
    "vibrancyMode": "exponential",
    "vibrancyBoost": 1.8,
    "vibrancyThreshold": 8.0,
    "highlightThreshold": 96,
    "highlightBoost": 1.6,
    "enablePaletteReduction": true,
    "paletteReduction": 4.0,
    "substrateMode": "auto",
    "substrateTolerance": 3.0,
    "shadowPoint": 12,
    "enableHueGapAnalysis": true,
    "hueLockAngle": 45,
    "colorMode": "color",
    "preserveWhite": true,
    "preserveBlack": false,
    "ignoreTransparent": true,
    "maskProfile": "Gray Gamma 2.2",
    "neutralSovereigntyThreshold": 25,
    "neutralCentroidClampThreshold": 5.0,
    "preprocessingIntensity": "medium"
  }
}
